LatestNews_timestamp,title,link
11 Min Ago,"China's Xi urges AI cooperation, rejects ‘Cold War mentality’ at SCO summit",https://www.cnbc.com/2025/09/01/sco-summit-xi-ai-cooperation-reject-cold-war-mentality-putin-modi-china-india-russia.html
1 Hour Ago,BYD’s Hong Kong shares fall nearly 8% after quarterly profit drop,https://www.cnbc.com/2025/09/01/byd-hong-kong-shares-fall-nearly-8percent-after-quarterly-profit-drop.html
1 Hour Ago,"China's August factory activity beats estimates, expanding at fastest pace in five months: private survey ",https://www.cnbc.com/2025/09/01/chinas-august-factory-activity-beats-estimates-expanding-at-fastest-pace-in-5-months.html
2 Hours Ago, Tariff uncertainty intensifies with the U.S. court's ruling,https://www.cnbc.com/2025/09/01/cnbc-daily-open-tariff-uncertainty-intensifies-with-the-us-courts-ruling.html
3 Hours Ago,Asia markets trade mixed as investors assess China's RatingDog manufacturing data,https://www.cnbc.com/2025/09/01/2025/09/01/asia-stock-markets-today-live-updates-nikkei-225-asx-200-kospi-hang-seng-csi-300-sensex-nifty-50.html
4 Hours Ago,Spanish stocks have surged this year — and there could be more upside ahead,https://www.cnbc.com/2025/09/01/why-spains-stock-market-is-booming-and-what-might-come-next.html
7 Hours Ago,Rudy Giuliani hospitalized with serious injuries after car accident,https://www.cnbc.com/2025/08/31/rudy-giuliani-hospitalized-after-car-accident-spokesman.html
11 Hours Ago,Trump trade adviser blasts tariff ruling: It's 'weaponized partisan injustice',https://www.cnbc.com/2025/08/31/trump-trade-adviser-tariff-ruling-peter-navarro-.html
13 Hours Ago,"The top 10 jobs offering remote, part-time work in 2025, says new report",https://www.cnbc.com/2025/08/31/the-top-job-titles-for-remote-part-time-work-according-to-flexjobs-report.html
14 Hours Ago,I've studied over 200 kids—6 'magic phrases' that make children listen to parents,https://www.cnbc.com/2025/08/31/child-psychologist-parents-who-raise-kids-who-listen-use-6-magic-phrases.html
14 Hours Ago,"After losing her husband, a therapist's second marriage opened 'new possibilities’",https://www.cnbc.com/2025/08/31/after-losing-her-husband-therapists-second-marriage-led-to-new-possibilities.html
15 Hours Ago,Op-ed: Nvidia's fate in China may look a lot like what BYD did to Tesla ,https://www.cnbc.com/2025/08/31/nvidia-chips-china-byd-tesla.html
15 Hours Ago,The man behind OpenAI's global expansion and its effort to win the enterprise,https://www.cnbc.com/2025/08/31/openais-brad-lightcap-leads-global-expansion-pursuit-of-enterprise.html
15 Hours Ago,Rhode Island's 'Taylor Swift Tax' on vacation homes of the wealthy spreads,https://www.cnbc.com/2025/08/31/taylor-swift-tax-on-high-end-vacation-homes-spreads-to-more-states.html
16 Hours Ago,Hw the U.S. Open's signature Honey Deuce cocktail price stacks up with inflation,https://www.cnbc.com/2025/08/31/honey-deuce-us-open-signature-cocktail-price-inflation.html
16 Hours Ago,This Chinese property stock is defying the slump and poised to soar,https://www.cnbc.com/2025/08/31/this-chinese-property-stock-is-defying-the-slump-and-poised-to-soar-barclays-predicts.html
16 Hours Ago,"Global banks, gold miners are strong opportunities, Lazard portfolio manager says",https://www.cnbc.com/2025/08/31/global-banks-gold-miners-are-strong-opportunities-lazard-manager-says.html
16 Hours Ago,Bitcoin dominance could return in September as crypto traders await Fed decision,https://www.cnbc.com/2025/08/31/bitcoin-dominance-could-return-in-september-as-crypto-traders-await-fed-decision.html
16 Hours Ago,"Here's how to get the $7,500 EV tax credit — even after the Sept. 30 deadline",https://www.cnbc.com/2025/08/31/how-to-get-7500-ev-tax-credit-after-the-deadline.html
19 Hours Ago,Matcha mania turns the green powder into gold,https://www.cnbc.com/2025/08/31/matcha-mania-turns-the-green-powder-into-gold.html
19 Hours Ago,"Global week ahead: Welcome to September, Wall Street’s least-loved month",https://www.cnbc.com/2025/08/31/global-week-ahead-welcome-to-september-wall-streets-least-loved-month.html
20 Hours Ago,Billionaire founder Lucy Guo started out making money on the playground as a kid,https://www.cnbc.com/2025/08/31/billionaire-founder-lucy-guo-started-out-making-money-on-the-playground.html
"August 30, 2025",Trump tariffs voided by — and ones that are safe from — appeals court ruling,https://www.cnbc.com/2025/08/30/trump-trade-tariffs-appeals.html
"August 30, 2025","CDC asks staff to return to office Sept. 15, five weeks after HQ shooting",https://www.cnbc.com/2025/08/30/cdc-asks-all-staff-to-return-to-office-sept-15-after-hq-shooting.html
"August 30, 2025",Trump could damage Fed independence: longtime investor Rebecca Patterson,https://www.cnbc.com/2025/08/30/trump-firing-cook-could-damage-fed-independence-rebecca-patterson.html
"August 30, 2025",Look inside the $17 million Brooklyn penthouse in Spike Lee's 'Highest 2 Lowest',https://www.cnbc.com/2025/08/30/look-inside-penthouse-spike-lee-highest-2-lowest-film.html
"August 30, 2025",I'm 78-years-old—my memory is 'razor sharp': 5 things I do every day for a healthy brain,https://www.cnbc.com/2025/08/30/im-78-years-old-and-my-memory-is-razor-sharpi-do-5-things-every-day.html
"August 30, 2025","32-year-old bride spent $18,000 buying 15 dresses before her wedding",https://www.cnbc.com/2025/08/30/why-brides-are-buying-more-wedding-related-outfits-than-ever-experts.html
"August 30, 2025",Powerball jackpot hits $1 billion—here's after-tax payout by state,https://www.cnbc.com/2025/08/30/powerball-jackpot-nears-1-billion-dollars.html
"August 30, 2025",The 10 private colleges with the best ROI in the U.S.,https://www.cnbc.com/2025/08/30/us-private-colleges-best-roi.html
